{
  "channel": "c2-reach",
  "platform": "facebook",
  "video_id": "style-c2",
  "date": "2026-10-04",
  "style_version": "c2-archive-gold-v1",
  "voice": "kokoro/am_fenrir/1",
  "cta_kind": "follow",
  "cta_text": "Follow",
  "cta_say": "Follow the page for more backstories.",
  "end_card_handle": null,
  "destination": {
    "via": "forge-queue",
    "handle": "pending_retry_2026-10-05",
    "page_id": "1320532171147125"
  },
  "size": {
    "width": 1080,
    "height": 1920
  },
  "video_sha256": "82ac0d08ef8e3bc9d0c3cb52a5dfe5f9b340fe32e39b7509b59b33a44ba395ba",
  "qa_status": "pass",
  "files": {
    "video": "c2-reach-facebook-2026-10-04-style-c2.mp4",
    "caption": "c2-reach-facebook-2026-10-04-style-c2.caption.txt"
  }
}
