{
  "channel": "c1-automation",
  "platform": "instagram",
  "video_id": "style-c1",
  "date": "2026-10-04",
  "style_version": "c1-night-signal-v1",
  "voice": "kokoro/af_heart/1.15",
  "cta_kind": "follow",
  "cta_text": "Follow",
  "cta_say": "Follow for one business automation every day.",
  "end_card_handle": "@theautomationguynavin",
  "destination": {
    "via": "forge-queue",
    "handle": "@theautomationguynavin"
  },
  "size": {
    "width": 1080,
    "height": 1920
  },
  "video_sha256": "e1827736907962989808a64f8ec2671e3824077f233c34c25eb92ada51383905",
  "qa_status": "pass",
  "files": {
    "video": "c1-automation-instagram-2026-10-04-style-c1.mp4",
    "caption": "c1-automation-instagram-2026-10-04-style-c1.caption.txt"
  }
}
