{
  "channel": "c1-automation",
  "platform": "youtube",
  "video_id": "style-c1",
  "date": "2026-10-04",
  "style_version": "c1-night-signal-v1",
  "voice": "kokoro/af_heart/1.15",
  "cta_kind": "follow",
  "cta_text": "Subscribe",
  "cta_say": "Subscribe for more business automations.",
  "end_card_handle": "@theautomationguynavin",
  "destination": {
    "via": "n8n",
    "handle": "@theautomationguynavin"
  },
  "size": {
    "width": 1080,
    "height": 1920
  },
  "video_sha256": "17d8852d4fcce51932c4d0f0f10f52b6a9987eadd668872a6ffb1f049f57235e",
  "qa_status": "pass",
  "files": {
    "video": "c1-automation-youtube-2026-10-04-style-c1.mp4",
    "caption": "c1-automation-youtube-2026-10-04-style-c1.caption.txt",
    "thumbnail": "c1-automation-youtube-2026-10-04-style-c1.thumbnail.png"
  }
}
