{
  "channel": "c1-automation",
  "platform": "facebook",
  "video_id": "style-c1",
  "date": "2026-10-04",
  "style_version": "c1-night-signal-v1",
  "voice": "kokoro/af_heart/1.15",
  "cta_kind": "follow",
  "cta_text": "Follow",
  "cta_say": "Follow the page for more business automations.",
  "end_card_handle": null,
  "destination": {
    "via": "forge-queue",
    "handle": "pending_retry_2026-10-05",
    "page_id": "1429203763599559"
  },
  "size": {
    "width": 1080,
    "height": 1920
  },
  "video_sha256": "effd3b9013674a52bfbe6a371f019791480574f912d082c462e00d5e1e988bb6",
  "qa_status": "pass",
  "files": {
    "video": "c1-automation-facebook-2026-10-04-style-c1.mp4",
    "caption": "c1-automation-facebook-2026-10-04-style-c1.caption.txt"
  }
}
